{
  "schema_version": "1",
  "asset_id": "EA-20261022-01",
  "proposal_id": "20261022-1705-decision-domain-taxonomy",
  "record_path": "assets/20261022-1705-decision-domain-taxonomy/EA-20261022-01-asset-domain-taxonomy.md",
  "record_sha256": "fe2c6c1ab0dbe0c1aa1fee05d8026c2817ecd84b4db012b4498eadafb7acde87",
  "content_sha256": "e113accb5e0d77ecde827ecbdbf4eb3796fe3208601e372ee6e2f44027702b24",
  "approver": "LiJiaT",
  "approver_role": "asset owner",
  "decision": "approved",
  "approved_at": "2026-10-22",
  "scope": {
    "layer": "公共级",
    "projects": [],
    "domains": [],
    "ai_form": "Memory",
    "owner": "AI 平台团队",
    "provenance_status": "source-excerpt",
    "release_channel": "component-library"
  },
  "release_channel": "component-library",
  "basis": "owner approval recorded in reviews/20261022-1705-decision-domain-taxonomy.md (approved 2026-10-22)",
  "binding_note": "2026-10-24 将既有 owner 批准回溯绑定到当前内容 hash；同日对齐 provenance 版本基线为 v0.7 revision 5267。绑定后内容变更即失效。"
}
