{
  "schema_version": "1",
  "asset_id": "EA-20261022-04",
  "proposal_id": "20261022-1705-ai-public-rules",
  "record_path": "assets/20261022-1705-ai-public-rules/EA-20261022-04-verify-or-review-before-delivery.md",
  "record_sha256": "907b91119ec1e9a67dd25f950bec0ba7b20abc7f71f7afc411c067f122b84a18",
  "content_sha256": "54fe3ab87812b9da1689b7c563f823659b7e70660329d119dc6613ce4f5705bc",
  "approver": "LiJiaT",
  "approver_role": "asset owner",
  "decision": "approved",
  "approved_at": "2026-10-22",
  "scope": {
    "layer": "公共级",
    "projects": [],
    "domains": [],
    "ai_form": "Rule",
    "owner": "AI 平台团队",
    "provenance_status": "source-excerpt",
    "release_channel": "component-library"
  },
  "release_channel": "component-library",
  "basis": "owner approval recorded in reviews/20261022-1705-ai-public-rules.md (approved 2026-10-22)",
  "binding_note": "2026-10-24 将既有 owner 批准回溯绑定到当前内容 hash；同日对齐 provenance 版本基线为 v0.7 revision 5267。绑定后内容变更即失效。"
}
