{
  "schema_version": "1",
  "asset_id": "EA-20261022-09",
  "proposal_id": "20261022-1705-hbm3e-dft-meeting",
  "record_path": "assets/20261022-1705-hbm3e-dft-meeting/EA-20261022-09-stack-level-repair-decision.md",
  "record_sha256": "32bc1c4a01076be2dd233782080b8477b76e08d4cd93d623b3968e9f38fa5c94",
  "content_sha256": "b44f13c3587b6d3990bb92e6226796069da40c652d1cc492ab3b3fdc2b96fe99",
  "approver": "LiJiaT",
  "approver_role": "asset owner",
  "decision": "approved",
  "approved_at": "2026-10-22",
  "scope": {
    "layer": "领域级",
    "projects": [
      "HBM"
    ],
    "domains": [
      "DFT",
      "设计"
    ],
    "ai_form": "Memory",
    "owner": "DFT 领域 owner",
    "provenance_status": "synthetic",
    "release_channel": "test-only"
  },
  "release_channel": "test-only",
  "basis": "owner approval recorded in reviews/20261023-domain-relocation.md (approved 2026-10-22)",
  "binding_note": "2026-10-24 将既有 owner 批准回溯绑定到当前内容 hash；同日对齐 provenance 版本基线为 v0.7 revision 5267。绑定后内容变更即失效。"
}
