{
  "schema_version": "1",
  "asset_id": "EA-20261022-07",
  "proposal_id": "20261022-1705-hbm3e-dft-meeting",
  "record_path": "assets/20261022-1705-hbm3e-dft-meeting/EA-20261022-07-hbm3e-dft-env-baseline.md",
  "record_sha256": "e30c3b5f61d1be6e919d5839cdd3f1ef37054809ef47e7540a1e880a59ec1e7d",
  "content_sha256": "6103771ec0a1ac05142c5e5f62890386fe0286a9dadd73a2aaa4fe8a54e91d9c",
  "approver": "LiJiaT",
  "approver_role": "asset owner",
  "decision": "approved",
  "approved_at": "2026-10-22",
  "scope": {
    "layer": "项目级",
    "projects": [
      "HBM"
    ],
    "domains": [
      "DFT"
    ],
    "ai_form": "Memory",
    "owner": "HBM 项目负责人",
    "provenance_status": "synthetic",
    "release_channel": "test-only"
  },
  "release_channel": "test-only",
  "basis": "owner approval recorded in reviews/20261022-1705-hbm3e-dft-meeting.md (approved 2026-10-22)",
  "binding_note": "2026-10-24 将既有 owner 批准回溯绑定到当前内容 hash；同日对齐 provenance 版本基线为 v0.7 revision 5267。绑定后内容变更即失效。"
}
